33-94;33;Projekt;ZwiÍkszenie liczby innowacyjnych przedsiÍbiorstw poprzez dwuetapowe wsparcie  pomys≥odawcÛw projektÛw innowacyjnych;POIG.03.01.00-00-003/09-04;Program Operacyjny Innowacyjna Gospodarka;POIG.03.00.00;POIG.03.01.00;;22,557,992.52;22,557,992.52;22,557,992.52;19,174,293.64;AKCELERATOR INNOWACJI NOT SP”£KA Z OGRANICZON• ODPOWIEDZIALNOåCI•;5252448033;00-050;Warszawa;Mazowieckie;Powiat m. st. Warszawa;07 Inwestycje w przedsiÍbiorstwa bezpoúrednio zwiπzane z dziedzinπ badaÒ i innowacji (innowacyjne technologie, tworzenie przedsiÍbiorstw przez uczelnie, istniejπce oúrodki B+RT i przedsiÍbiorstwa itp.);spÛ≥ka z ograniczonπ odpowiedzialnoúciπ - duøe przedsiÍbiorstwo;00 Nie dotyczy;POIG.03.01.00-00-003/09-05;Nie;2011/03/29;2011/03/29
33-95;33;Projekt;LMS DigitalFarm - kapita≥ dla innowacyjnych przedsiÍwziÍÊ marketingowych;POIG.03.01.00-00-003/10-00;Program Operacyjny Innowacyjna Gospodarka;POIG.03.00.00;POIG.03.01.00;;9,566,120.00;9,566,120.00;9,566,120.00;8,131,202.00;LMS SpÛ≥ka z ograniczonπ odpowiedzialnoúciπ;7781451409;61-734;PoznaÒ;Wielkopolskie;Powiat m. PoznaÒ;"62 RozwÛj systemÛw i strategii uczenia siÍ przez ca≥e øycie w przedsiÍbiorstwach; szkolenia i us≥ugi na rzecz zwiÍkszenia zdolnoúci adaptacyjnych pracownikÛw do zmian; promowanie przedsiÍbiorczoúci i innowacji";spÛ≥ka z ograniczonπ odpowiedzialnoúciπ - mikro przedsiÍbiorstwo;00 Nie dotyczy;POIG.03.01.00-00-003/10-01;Nie;2011/04/04;2011/04/07
33-96;33;Projekt;InQbe ñ inkubator projektÛw technologicznych i internetowych;POIG.03.01.00-00-004/08-10;Program Operacyjny Innowacyjna Gospodarka;POIG.03.00.00;POIG.03.01.00;;20,469,444.82;20,469,444.82;20,469,444.82;17,399,028.10;InQbe Sp. z o. o.;5242568712;10-950;Olsztyn;;;07 Inwestycje w przedsiÍbiorstwa bezpoúrednio zwiπzane z dziedzinπ badaÒ i innowacji (innowacyjne technologie, tworzenie przedsiÍbiorstw przez uczelnie, istniejπce oúrodki B+RT i przedsiÍbiorstwa itp.);spÛ≥ka z ograniczonπ odpowiedzialnoúciπ - úrednie przedsiÍbiorstwo;00 Nie dotyczy;;;2011/05/12;2011/05/31
33-97;33;Projekt;INNOWACJA KLUCZEM DO SUKCESU;POIG.03.01.00-00-005/08-06;Program Operacyjny Innowacyjna Gospodarka;POIG.03.00.00;POIG.03.01.00;;20,527,749.78;20,527,749.78;20,527,749.78;17,448,587.31;Be≥chatowsko Kleszczowski Park Przemys≥owo Technologiczny Sp. z o.o.;7692018378;97-400;Be≥chatÛw;£Ûdzkie;Powiat be≥chatowski;07 Inwestycje w przedsiÍbiorstwa bezpoúrednio zwiπzane z dziedzinπ badaÒ i innowacji (innowacyjne technologie, tworzenie przedsiÍbiorstw przez uczelnie, istniejπce oúrodki B+RT i przedsiÍbiorstwa itp.);spÛ≥ka z ograniczonπ odpowiedzialnoúciπ - duøe przedsiÍbiorstwo;00 Nie dotyczy;POIG.03.01.00-00-005/08-09;Nie;2011/03/14;2011/03/14
33-98;33;Projekt;incuBIT.NETable - Instytut preinkubacji i komercjalizacji przedsiÍwziÍÊ opartych na technologiach sektora Internet/Mobile;POIG.03.01.00-00-006/08-07;Program Operacyjny Innowacyjna Gospodarka;POIG.03.00.00;POIG.03.01.00;;18,663,083.14;18,663,083.14;18,663,083.14;15,863,620.67;Trinity Adventure SpÛ≥ka z ograniczonπ odpowiedzialnoúciπ;6751391866;50-079;Wroc≥aw;Dolnoúlπskie;Powiat m. Wroc≥aw;07 Inwestycje w przedsiÍbiorstwa bezpoúrednio zwiπzane z dziedzinπ badaÒ i innowacji (innowacyjne technologie, tworzenie przedsiÍbiorstw przez uczelnie, istniejπce oúrodki B+RT i przedsiÍbiorstwa itp.);spÛ≥ka z ograniczonπ odpowiedzialnoúciπ - ma≥e przedsiÍbiorstwo;00 Nie dotyczy;POIG.03.01.00-00-006/08-14;Nie;2011/03/25;2011/04/04
33-99;33;Projekt;ÑSpeedUp IQbator ñ inteligentny kapita≥ dla innowacyjnych przedsiewziecî;POIG.03.01.00-00-008/09-03;Program Operacyjny Innowacyjna Gospodarka;POIG.03.00.00;POIG.03.01.00;;14,397,567.50;14,397,567.50;14,397,567.50;12,237,932.38;SpeedUp IQbator Sp. z o.o.;7781461566;61-775;Poznan;Wielkopolskie;Powiat m. PoznaÒ;07 Inwestycje w przedsiÍbiorstwa bezpoúrednio zwiπzane z dziedzinπ badaÒ i innowacji (innowacyjne technologie, tworzenie przedsiÍbiorstw przez uczelnie, istniejπce oúrodki B+RT i przedsiÍbiorstwa itp.);spÛ≥ka z ograniczonπ odpowiedzialnoúciπ - mikro przedsiÍbiorstwo;00 Nie dotyczy;;;2011/03/15;2011/04/13
33-100;33;Projekt;S2B Science 2 Business Inkubator Innowacyjnosci;POIG.03.01.00-00-009/09-02;Program Operacyjny Innowacyjna Gospodarka;POIG.03.00.00;POIG.03.01.00;;19,616,681.48;19,616,681.48;19,616,681.48;16,674,179.26;"Fundacja Na Rzecz Budowy Spo≥eczeÒstwa Opartego Na Wiedzy ""Nowe Media""";7393369041;10-718;Olsztyn;WarmiÒsko-mazurskie;Powiat m. Olsztyn;07 Inwestycje w przedsiÍbiorstwa bezpoúrednio zwiπzane z dziedzinπ badaÒ i innowacji (innowacyjne technologie, tworzenie przedsiÍbiorstw przez uczelnie, istniejπce oúrodki B+RT i przedsiÍbiorstwa itp.);fundacja;00 Nie dotyczy;POIG.03.01.00-00-009/09-05;Nie;2011/03/23;2011/03/28
33-101;33;Projekt;NICKEL INKUBATOR ñ wsparcie innowacyjnych pomys≥Ûw biznesowych;POIG.03.01.00-00-010/10-00;Program Operacyjny Innowacyjna Gospodarka;POIG.03.00.00;POIG.03.01.00;;9,475,478.00;9,475,478.00;9,475,478.00;8,054,156.30;Nickel Technology Park PoznaÒ sp. z o.o.;7811719243;62-002;Z≥otniki;Wielkopolskie;Powiat poznaÒski;"62 RozwÛj systemÛw i strategii uczenia siÍ przez ca≥e øycie w przedsiÍbiorstwach; szkolenia i us≥ugi na rzecz zwiÍkszenia zdolnoúci adaptacyjnych pracownikÛw do zmian; promowanie przedsiÍbiorczoúci i innowacji";spÛ≥ka z ograniczonπ odpowiedzialnoúciπ - úrednie przedsiÍbiorstwo;00 Nie dotyczy;POIG.03.01.00-00-010/10-01;Nie;2011/03/25;2011/04/06
33-102;33;Projekt;KIGMED.eu - Inkubator Innowacyjnych Technologii dla e-Medycyny;POIG.03.01.00-00-011/10-00;Program Operacyjny Innowacyjna Gospodarka;POIG.03.00.00;POIG.03.01.00;;9,965,404.00;9,965,404.00;9,965,404.00;8,470,593.40;Krajowa Izba Gospodarcza;5260001708;00-074;Warszawa;Mazowieckie;Powiat m. st. Warszawa;"62 RozwÛj systemÛw i strategii uczenia siÍ przez ca≥e øycie w przedsiÍbiorstwach; szkolenia i us≥ugi na rzecz zwiÍkszenia zdolnoúci adaptacyjnych pracownikÛw do zmian; promowanie przedsiÍbiorczoúci i innowacji";samorzπd gospodarczy i zawodowy;00 Nie dotyczy;POIG.03.01.00-00-011/10-01;Nie;2011/03/21;2011/03/21
33-103;33;Projekt;Inicjowanie innowacyjnych przedsiÍwziÍÊ gospodarczych wykorzystujπcych potencja≥ lotnictwa lekkiego;POIG.03.01.00-00-012/09-04;Program Operacyjny Innowacyjna Gospodarka;POIG.03.00.00;POIG.03.01.00;;10,811,006.00;10,742,600.00;10,742,600.00;9,131,210.00;Bielski Park Technologiczny Lotnictwa, PrzedsiÍbiorczoúci i Innowacji Sp. z o.o.;5480018674;43-512;KaniÛw;ålπskie;Powiat bielski;07 Inwestycje w przedsiÍbiorstwa bezpoúrednio zwiπzane z dziedzinπ badaÒ i innowacji (innowacyjne technologie, tworzenie przedsiÍbiorstw przez uczelnie, istniejπce oúrodki B+RT i przedsiÍbiorstwa itp.);spÛ≥ka z ograniczonπ odpowiedzialnoúciπ - ma≥e przedsiÍbiorstwo;00 Nie dotyczy;POIG.03.01.00-00-012/09-06;Nie;2011/03/24;2011/03/28
33-104;33;Projekt;Zainwestujmy w Innowacje - Inkubator Technologiczny;POIG.03.01.00-00-012/10-00;Program Operacyjny Innowacyjna Gospodarka;POIG.03.00.00;POIG.03.01.00;;9,810,200.00;9,810,200.00;9,810,200.00;7,357,650.00;Centrum Innowacji i Transferu Technologii Lubelskiego Parku Naukowo - Technologicznego Sp. z o.o.;9462394541;20-262;Lublin;Lubelskie;Powiat m. Lublin;"62 RozwÛj systemÛw i strategii uczenia siÍ przez ca≥e øycie w przedsiÍbiorstwach; szkolenia i us≥ugi na rzecz zwiÍkszenia zdolnoúci adaptacyjnych pracownikÛw do zmian; promowanie przedsiÍbiorczoúci i innowacji";spÛ≥ka z ograniczonπ odpowiedzialnoúciπ - ma≥e przedsiÍbiorstwo;00 Nie dotyczy;POIG.03.01.00-00-012/10-01;Nie;2011/03/15;2011/03/16
33-105;33;Projekt;Akcelerator EIT+ spÛ≥ek innowacyjnych o hybrydowym profilu branøowym;POIG.03.01.00-00-013/09-06;Program Operacyjny Innowacyjna Gospodarka;POIG.03.00.00;POIG.03.01.00;;13,226,104.29;13,047,700.00;13,047,700.00;11,090,545.00;Wroc≥awskie Centrum BadaÒ EIT+ Sp.z.o.o;8942930022;54-066;WROC£AW;Dolnoúlπskie;Powiat m. Wroc≥aw;07 Inwestycje w przedsiÍbiorstwa bezpoúrednio zwiπzane z dziedzinπ badaÒ i innowacji (innowacyjne technologie, tworzenie przedsiÍbiorstw przez uczelnie, istniejπce oúrodki B+RT i przedsiÍbiorstwa itp.);spÛ≥ka z ograniczonπ odpowiedzialnoúciπ - duøe przedsiÍbiorstwo;00 Nie dotyczy;;;2011/04/28;2011/05/11
33-106;33;Projekt;Inkubowanie nowych innowacyjnych spÛ≥ek w Krakowskim Parku Technologicznym;POIG.03.01.00-00-015/09-05;Program Operacyjny Innowacyjna Gospodarka;POIG.03.00.00;POIG.03.01.00;;20,177,214.06;20,177,214.06;20,177,214.06;17,150,631.95;Fundusz Zalπøkowy KPT SP. z o.o.;6751410670;31-864;KrakÛw;Ma≥opolskie;Powiat m. KrakÛw;07 Inwestycje w przedsiÍbiorstwa bezpoúrednio zwiπzane z dziedzinπ badaÒ i innowacji (innowacyjne technologie, tworzenie przedsiÍbiorstw przez uczelnie, istniejπce oúrodki B+RT i przedsiÍbiorstwa itp.);spÛ≥ka z ograniczonπ odpowiedzialnoúciπ - duøe przedsiÍbiorstwo;00 Nie dotyczy;POIG.03.01.00-00-015/09-06;Nie;2011/05/06;2011/05/10
33-107;33;Projekt;Inkubator Innowacji;POIG.03.01.00-00-015/10-00;Program Operacyjny Innowacyjna Gospodarka;POIG.03.00.00;POIG.03.01.00;;9,164,600.00;9,164,600.00;9,164,600.00;7,789,910.00;PoznaÒski Akademicki Inkubator PrzedsiÍbiorczoúci;9721127971;60-536;PoznaÒ;Wielkopolskie;Powiat m. PoznaÒ;"62 RozwÛj systemÛw i strategii uczenia siÍ przez ca≥e øycie w przedsiÍbiorstwach; szkolenia i us≥ugi na rzecz zwiÍkszenia zdolnoúci adaptacyjnych pracownikÛw do zmian; promowanie przedsiÍbiorczoúci i innowacji";stowarzyszenie;00 Nie dotyczy;POIG.03.01.00-00-015/10-01;Nie;2011/03/25;2011/04/05
33-108;33;Projekt;Dofinansowanie projektu wsparcia innowacyjnych przedsiÍwziÍÊ przez ARP S.A. w latach 2010 ñ 2015;POIG.03.01.00-00-017/09-03;Program Operacyjny Innowacyjna Gospodarka;POIG.03.00.00;POIG.03.01.00;;17,961,409.55;17,961,409.55;17,961,409.55;15,267,198.12;Agencja Rozwoju Pomorza S.A.;5830002002;80-387;GdaÒsk;Pomorskie;Powiat m. GdaÒsk;07 Inwestycje w przedsiÍbiorstwa bezpoúrednio zwiπzane z dziedzinπ badaÒ i innowacji (innowacyjne technologie, tworzenie przedsiÍbiorstw przez uczelnie, istniejπce oúrodki B+RT i przedsiÍbiorstwa itp.);spÛ≥ka akcyjna - duøe przedsiÍbiorstwo;00 Nie dotyczy;;;2011/05/17;2011/05/20
33-109;33;Projekt;Karpacki Akcelerator Innowacji Informatycznych;POIG.03.01.00-00-023/09-02;Program Operacyjny Innowacyjna Gospodarka;POIG.03.00.00;POIG.03.01.00;;3,993,480.00;3,993,480.00;3,993,480.00;3,394,458.00;Instytut Karpacki;7343010817;33-300;Nowy Sacz;Ma≥opolskie;Powiat m. Nowy Sπcz / Powiat nowosπdecki;07 Inwestycje w przedsiÍbiorstwa bezpoúrednio zwiπzane z dziedzinπ badaÒ i innowacji (innowacyjne technologie, tworzenie przedsiÍbiorstw przez uczelnie, istniejπce oúrodki B+RT i przedsiÍbiorstwa itp.);fundacja;00 Nie dotyczy;;;2011/04/06;2011/04/19
33-110;33;Projekt;Siec InwestorÛw KPT jako platforma wspierania inwestycji w MSP;POIG.03.03.01-00-001/09-04;Program Operacyjny Innowacyjna Gospodarka;POIG.03.00.00;POIG.03.03.00;POIG.03.03.01;992,672.73;992,672.73;992,672.73;843,771.82;Krakowski Park Technologiczny Sp. z o.o;6751157834;31-864;KrakÛw;Ma≥opolskie;Powiat m. KrakÛw;05 Us≥ugi w zakresie zaawansowanego wsparcia dla przedsiÍbiorstw i grup przedsiÍbiorstw;spÛ≥ka z ograniczonπ odpowiedzialnoúciπ - duøe przedsiÍbiorstwo;00 Nie dotyczy;POIG.03.03.01-00-001/09-06;Nie;2011/04/21;2011/04/26
33-111;33;Projekt;Gildia Anio≥Ûw Biznesu;POIG.03.03.01-00-005/09-06;Program Operacyjny Innowacyjna Gospodarka;POIG.03.00.00;POIG.03.03.00;POIG.03.03.01;7,457,764.95;7,457,764.95;7,457,764.95;6,339,100.21;£Ûdzka Agencja Rozwoju Regionalnego S.A. ;7250005574;90-002;£Ûdü ;£Ûdzkie;Powiat m. £Ûdü;05 Us≥ugi w zakresie zaawansowanego wsparcia dla przedsiÍbiorstw i grup przedsiÍbiorstw;spÛ≥ka akcyjna - duøe przedsiÍbiorstwo;00 Nie dotyczy;;;2011/04/18;2011/05/11
33-112;33;Projekt;VENTURE MULTITOUCH - wielop≥aszczyznowa platforma dostarczania inteligentnego kapita≥u przedsiÍbiorstwom technologicznym.;POIG.03.03.01-00-018/09-02;Program Operacyjny Innowacyjna Gospodarka;POIG.03.00.00;POIG.03.03.00;POIG.03.03.01;3,195,958.00;3,195,958.00;3,195,958.00;2,716,564.30;SpeedUp IQbator Sp. z o.o.;7781461566;61-775;PoznaÒ;Wielkopolskie;Powiat m. PoznaÒ;05 Us≥ugi w zakresie zaawansowanego wsparcia dla przedsiÍbiorstw i grup przedsiÍbiorstw;spÛ≥ka z ograniczonπ odpowiedzialnoúciπ - mikro przedsiÍbiorstwo;00 Nie dotyczy;;;2011/04/08;2011/04/22
33-113;33;Projekt;OgÛlnopolska sieÊ inwestorÛw prywatnych - aktywizacja oraz kojarzenie inwestorÛw ze úrodowiskiem MSP;POIG.03.03.01-00-021/09-03;Program Operacyjny Innowacyjna Gospodarka;POIG.03.00.00;POIG.03.03.00;POIG.03.03.01;6,500,595.06;6,500,595.06;6,500,595.06;5,525,505.80;Trinity Capital Business Network spÛ≥ka z ograniczonπ odpowiedzialnoúciπ spÛ≥ka komandytowa;8971742168;50-079;Wroc≥aw;Dolnoúlπskie;Powiat m. Wroc≥aw;05 Us≥ugi w zakresie zaawansowanego wsparcia dla przedsiÍbiorstw i grup przedsiÍbiorstw;spÛ≥ka komandytowa - mikro przedsiÍbiorstwo;00 Nie dotyczy;POIG.03.03.01-00-021/09-06;Nie;2011/03/02;2011/03/02
33-114;33;Projekt;Finansuj.pl;POIG.03.03.01-00-023/09-04;Program Operacyjny Innowacyjna Gospodarka;POIG.03.00.00;POIG.03.03.00;POIG.03.03.01;3,757,545.00;3,757,545.00;3,757,545.00;3,193,913.25;Fundacja Obserwatorium Zarzπdzania;7010000181;00-586;Warszawa;Mazowieckie;Powiat m. st. Warszawa;05 Us≥ugi w zakresie zaawansowanego wsparcia dla przedsiÍbiorstw i grup przedsiÍbiorstw;fundacja;00 Nie dotyczy;;;2011/02/28;2011/03/29
33-115;33;Projekt;Inwestycje kapita≥owe dla innowacyjnych przedsiÍwziÍÊ;POIG.03.03.01-00-024/09-03;Program Operacyjny Innowacyjna Gospodarka;POIG.03.00.00;POIG.03.03.00;POIG.03.03.01;1,733,705.91;1,589,533.75;1,589,533.75;1,351,103.68;Agencja Rozwoju Lokalnego SA;6320011505;43-600;Jaworzno;ålπskie;Powiat m. Jaworzno;05 Us≥ugi w zakresie zaawansowanego wsparcia dla przedsiÍbiorstw i grup przedsiÍbiorstw;spÛ≥ka akcyjna - ma≥e przedsiÍbiorstwo;00 Nie dotyczy;;;2011/03/02;2011/03/29
33-116;33;Projekt;Platforma HI-TECH. System Identyfikowania i Wspierania Inwestycji w Zaawansowane Technologie;POIG.03.03.01-00-031/09-03;Program Operacyjny Innowacyjna Gospodarka;POIG.03.00.00;POIG.03.03.00;POIG.03.03.01;1,393,155.04;1,393,155.04;1,393,155.04;1,184,181.78;INVESTIN SpÛ≥ka z ograniczonπ odpowiedzialnoúciπ;5252245152;00-660;Warszawa;Mazowieckie;Powiat m. st. Warszawa;05 Us≥ugi w zakresie zaawansowanego wsparcia dla przedsiÍbiorstw i grup przedsiÍbiorstw;spÛ≥ka z ograniczonπ odpowiedzialnoúciπ - mikro przedsiÍbiorstwo;00 Nie dotyczy;;;2011/02/25;2011/02/25
33-117;33;Projekt;Ponadregionalna SieÊ Anio≥Ûw Biznesu - Innowacja ;POIG.03.03.01-00-032/09-02;Program Operacyjny Innowacyjna Gospodarka;POIG.03.00.00;POIG.03.03.00;POIG.03.03.01;9,023,370.00;9,023,370.00;9,023,370.00;7,669,864.50;Fundacja Instytut Nauk Ekonomicznych i Spo≥ecznych;9512248392;02-792;Warszawa;Mazowieckie;Powiat m. st. Warszawa;"62 RozwÛj systemÛw i strategii uczenia siÍ przez ca≥e øycie w przedsiÍbiorstwach; szkolenia i us≥ugi na rzecz zwiÍkszenia zdolnoúci adaptacyjnych pracownikÛw do zmian; promowanie przedsiÍbiorczoúci i innowacji";fundacja;00 Nie dotyczy;POIG.03.03.01-00-032/09-02-K01;Nie;2011/02/08;2011/02/14
33-118;33;Projekt;Aktywizacja i podnoszenie kompetencji podmiotÛw rynku anio≥Ûw biznesu w Polsce;POIG.03.03.01-00-855/08-09;Program Operacyjny Innowacyjna Gospodarka;POIG.03.00.00;POIG.03.03.00;POIG.03.03.01;14,624,246.00;14,624,246.00;14,624,246.00;12,430,609.10;Polska Konfederacja PracodawcÛw Prywatnych Lewiatan;5262353400;00-591;Warszawa;Mazowieckie;Powiat m. st. Warszawa;05 Us≥ugi w zakresie zaawansowanego wsparcia dla przedsiÍbiorstw i grup przedsiÍbiorstw;organizacja pracodawcÛw;00 Nie dotyczy;POIG.03.03.01-00-855/08-14;Nie;2011/03/18;2011/03/18
33-119;33;Projekt;Inwestycje w innowacyjne przedsiÍwziÍcia z sektora MSP;POIG.03.03.01-00-866/08-04;Program Operacyjny Innowacyjna Gospodarka;POIG.03.00.00;POIG.03.03.00;POIG.03.03.01;3,593,898.04;3,593,898.04;3,593,898.04;3,054,813.33;Dolnoúlπska Agencja Rozwoju Regionalnego S.A;8860003433;58-300;Wa≥brzych;Dolnoúlπskie;Powiat wa≥brzyski;05 Us≥ugi w zakresie zaawansowanego wsparcia dla przedsiÍbiorstw i grup przedsiÍbiorstw;spÛ≥ka akcyjna - duøe przedsiÍbiorstwo;00 Nie dotyczy;POIG.03.03.01-00-866/08-10;Nie;2011/05/12;2011/05/13
33-120;33;Projekt;SIE∆ INWESTOR”W PRYWATNYCH SATUS;POIG.03.03.01-00-869/08-07;Program Operacyjny Innowacyjna Gospodarka;POIG.03.00.00;POIG.03.03.00;POIG.03.03.01;6,503,509.73;6,503,509.73;6,503,509.73;5,527,983.27;SATUS Venture Sp. z o.o. ;9372456190;30-063;KrakÛw;Ma≥opolskie;Powiat m. KrakÛw;05 Us≥ugi w zakresie zaawansowanego wsparcia dla przedsiÍbiorstw i grup przedsiÍbiorstw;spÛ≥ka z ograniczonπ odpowiedzialnoúciπ - duøe przedsiÍbiorstwo;00 Nie dotyczy;POIG.03.03.01-00-869/08-11;Nie;2011/03/25;2011/03/25
33-121;33;Projekt;Badanie i wdroøenie systemu kanalizacji sanitarnej ma≥oúrednicowej zrÛwnowaøonego przep≥ywu. Nr statystyczny PKWiU 43.22.11;POIG.04.01.00-06-007/09-06;Program Operacyjny Innowacyjna Gospodarka;POIG.04.00.00;POIG.04.01.00;;6,771,000.00;5,550,000.00;3,848,400.00;3,271,140.00;PrzedsiÍbiorstwo UrzπdzeÒ Ochrony årodowiska Biotop sp. z o.o. ;9220003353;22-400;ZamoúÊ;Lubelskie;Powiat m. ZamoúÊ / Powiat zamojski;07 Inwestycje w przedsiÍbiorstwa bezpoúrednio zwiπzane z dziedzinπ badaÒ i innowacji (innowacyjne technologie, tworzenie przedsiÍbiorstw przez uczelnie, istniejπce oúrodki B+RT i przedsiÍbiorstwa itp.);spÛ≥ka z ograniczonπ odpowiedzialnoúciπ - mikro przedsiÍbiorstwo;00 Nie dotyczy;;;2011/04/04;2011/04/11
33-122;33;Projekt;Badania nad budowπ architektury masowego systemu pocztowego nowej generacji przy za≥oøeniu duøej skalowalnoúci umoøliwiajπcej zastosowanie produktu na skalÍ globalnπ;POIG.04.01.00-12-030/09-04;Program Operacyjny Innowacyjna Gospodarka;POIG.04.00.00;POIG.04.01.00;;8,135,947.06;5,686,407.32;2,843,203.66;2,416,723.11;INTERIA.PL S.A.;6772118727;31-946;KrakÛw;Ma≥opolskie;Powiat m. KrakÛw;07 Inwestycje w przedsiÍbiorstwa bezpoúrednio zwiπzane z dziedzinπ badaÒ i innowacji (innowacyjne technologie, tworzenie przedsiÍbiorstw przez uczelnie, istniejπce oúrodki B+RT i przedsiÍbiorstwa itp.);spÛ≥ka akcyjna - duøe przedsiÍbiorstwo;00 Nie dotyczy;POIG.04.01.00-12-030/09-02;Nie;2011/04/22;2011/04/28
33-123;33;Projekt;Uniwersalna platforma bezpieczeÒstwa uøytkownikÛw mobilnych LabMSF Platform - Mobile Secure Family;POIG.04.01.00-12-115/09-01;Program Operacyjny Innowacyjna Gospodarka;POIG.04.00.00;POIG.04.01.00;;1,255,270.00;1,029,000.00;716,450.00;608,982.50;Laboratorium MSF Sp. z ograniczonπ odpowiedzialnoúciπ;5272530329;31-147;KrakÛw;Ma≥opolskie;Powiat m. KrakÛw;07 Inwestycje w przedsiÍbiorstwa bezpoúrednio zwiπzane z dziedzinπ badaÒ i innowacji (innowacyjne technologie, tworzenie przedsiÍbiorstw przez uczelnie, istniejπce oúrodki B+RT i przedsiÍbiorstwa itp.);spÛ≥ka z ograniczonπ odpowiedzialnoúciπ - mikro przedsiÍbiorstwo;00 Nie dotyczy;;;2011/02/28;2011/03/01
33-124;33;Projekt;Opracowanie i wdroøenie innowacyjnej, przyjaznej úrodowisku technologii modyfikacji asfaltÛw drogowych gumπ;POIG.04.01.00-14-188/09-00;Program Operacyjny Innowacyjna Gospodarka;POIG.04.00.00;POIG.04.01.00;;1,749,968.00;1,229,700.00;368,910.00;313,573.50;Polski Asfalt Sp. z o. o.;8511027240;05-800;PruszkÛw;Mazowieckie;Powiat pruszkowski;07 Inwestycje w przedsiÍbiorstwa bezpoúrednio zwiπzane z dziedzinπ badaÒ i innowacji (innowacyjne technologie, tworzenie przedsiÍbiorstw przez uczelnie, istniejπce oúrodki B+RT i przedsiÍbiorstwa itp.);spÛ≥ka z ograniczonπ odpowiedzialnoúciπ - duøe przedsiÍbiorstwo;00 Nie dotyczy;;;2011/04/01;2011/03/07
33-125;33;Projekt;Opracowanie i wdroøenie nowoczesnej koncepcji specjalistycznych salonÛw sprzedaøy drzwi i pod≥Ûg;POIG.04.01.00-14-191/09-01;Program Operacyjny Innowacyjna Gospodarka;POIG.04.00.00;POIG.04.01.00;;9,389,200.00;5,130,000.00;1,539,000.00;1,308,150.00;SK£ADY VOX SP”£KA Z OGRANICZON• ODPOWIEDZIALNOåCI• SP”£KA KOMANDYTOWO-AKCYJNA;7790016245;62-006;Janikowo;Wielkopolskie;Powiat poznaÒski;07 Inwestycje w przedsiÍbiorstwa bezpoúrednio zwiπzane z dziedzinπ badaÒ i innowacji (innowacyjne technologie, tworzenie przedsiÍbiorstw przez uczelnie, istniejπce oúrodki B+RT i przedsiÍbiorstwa itp.);spÛ≥ka z ograniczonπ odpowiedzialnoúciπ - duøe przedsiÍbiorstwo;00 Nie dotyczy;;;2011/03/16;2011/04/28
33-126;33;Projekt;InnowacyjnoúÊ nowego wzoru uøytkowego w parze z ekologiπ;POIG.04.02.00-12-012/09-01;Program Operacyjny Innowacyjna Gospodarka;POIG.04.00.00;POIG.04.02.00;;4,846,014.00;4,027,700.00;2,773,390.00;2,357,381.50;PrzedsiÍbiorstwo Produkcyjno Handlowo Us≥ugowe STALMARK Marek Kuüma;5512157664;32-600;OúwiÍcim;Ma≥opolskie;Powiat oúwiÍcimski;07 Inwestycje w przedsiÍbiorstwa bezpoúrednio zwiπzane z dziedzinπ badaÒ i innowacji (innowacyjne technologie, tworzenie przedsiÍbiorstw przez uczelnie, istniejπce oúrodki B+RT i przedsiÍbiorstwa itp.);osoba fizyczna prowadzπca dzia≥alnoúÊ gospodarczπ - ma≥e przedsiÍbiorstwo;00 Nie dotyczy;;;2011/04/18;2011/05/04
33-127;33;Projekt;Wdroøenie innowacyjnych systemÛw paneli úciennych do konstrukcji elementÛw noúnych;POIG.04.02.00-24-008/09-01;Program Operacyjny Innowacyjna Gospodarka;POIG.04.00.00;POIG.04.02.00;;10,161,502.00;8,329,100.00;4,847,460.00;4,120,341.00;LS Tech-Homes SpÛ≥ka z ograniczonπ odpowiedzialnoúciπ;5472105335;43-300;Bielsko-Bia≥a;ålπskie;Powiat m. Bielsko-Bia≥a;07 Inwestycje w przedsiÍbiorstwa bezpoúrednio zwiπzane z dziedzinπ badaÒ i innowacji (innowacyjne technologie, tworzenie przedsiÍbiorstw przez uczelnie, istniejπce oúrodki B+RT i przedsiÍbiorstwa itp.);spÛ≥ka z ograniczonπ odpowiedzialnoúciπ - ma≥e przedsiÍbiorstwo;00 Nie dotyczy;POIG.04.02.00-24-008/09-02;Nie;2011/01/13;2011/03/29
33-128;33;Projekt;Wdroøenie innowacyjnej technologii us≥ugi serwisowania pojazdÛw ch≥odniczych;POIG.04.04.00-24-015/08-00;Program Operacyjny Innowacyjna Gospodarka;POIG.04.00.00;POIG.04.04.00;;37,038,270.46;28,022,768.00;14,011,384.00;11,909,676.40;FRIGIPOL SP. Z O.O.;5730013667;42-200;CzÍstochowa;ålπskie;Powiat m. CzÍstochowa;07 Inwestycje w przedsiÍbiorstwa bezpoúrednio zwiπzane z dziedzinπ badaÒ i innowacji (innowacyjne technologie, tworzenie przedsiÍbiorstw przez uczelnie, istniejπce oúrodki B+RT i przedsiÍbiorstwa itp.);spÛ≥ka z ograniczonπ odpowiedzialnoúciπ - ma≥e przedsiÍbiorstwo;00 Nie dotyczy;;;2011/05/05;2011/05/05
33-129;33;Projekt;Utworzenie Centrum Badawczo-Rozwojowego Technologii Betonowych Ren-Bet Sp. z o.o.;POIG.04.05.02-00-075/09-00;Program Operacyjny Innowacyjna Gospodarka;POIG.04.00.00;POIG.04.05.00;POIG.04.05.02;16,161,340.00;13,247,000.00;9,092,900.00;7,728,965.00;Ren-Bet Sp. z o.o.;6781002289;31-216;KrakÛw;Ma≥opolskie;Powiat m. KrakÛw;07 Inwestycje w przedsiÍbiorstwa bezpoúrednio zwiπzane z dziedzinπ badaÒ i innowacji (innowacyjne technologie, tworzenie przedsiÍbiorstw przez uczelnie, istniejπce oúrodki B+RT i przedsiÍbiorstwa itp.);spÛ≥ka z ograniczonπ odpowiedzialnoúciπ - ma≥e przedsiÍbiorstwo;00 Nie dotyczy;;;2011/03/31;2011/03/31
33-130;33;Projekt;RozwÛj Pierwszego Polskiego Klastra Budownictwa Pasywnego i Energooszczednego;POIG.05.01.00-00-004/09-04;Program Operacyjny Innowacyjna Gospodarka;POIG.05.00.00;POIG.05.01.00;;5,571,740.38;4,918,840.82;4,914,616.91;4,177,424.37;GÛrnoúlπski Park Przemys≥owy SpÛ≥ka z ograniczonπ odpowiedzialnoúciπ;9540020169;40-155;Katowice;ålπskie;Powiat m. Katowice;03 Transfer technologii i udoskonalanie sieci wspÛ≥pracy miÍdzy MåP, miÍdzy MåP a innymi przedsiÍbiorstwami, uczelniami, wszelkiego rodzaju instytucjami na poziomie szkolnictwa pomaturalnego, w≥adzami regionalnymi, oúrodkami badawczymi oraz biegunami naukowymi i technologicznymi (parkami naukowymi i technologicznymi, technopoliami itd.);spÛ≥ka z ograniczonπ odpowiedzialnoúciπ - mikro przedsiÍbiorstwo;00 Nie dotyczy;POIG.05.01.00-00-004/09-07;Nie;2011/02/12;2011/04/06
33-131;33;Projekt;Centrum Technologii Energetycznych Powiπzania Kooperacyjnego Dolnoúlπskiego Klastra Energii Odnawialnej;POIG.05.01.00-00-005/09-03;Program Operacyjny Innowacyjna Gospodarka;POIG.05.00.00;POIG.05.01.00;;10,088,500.00;10,088,500.00;9,873,500.00;8,392,475.00;"Oddzia≥ Terenowy Stowarzyszenia ""Wolna PrzedsiÍbiorczoúÊ""";8841003900;58-100;åwidnica;Dolnoúlπskie;Powiat úwidnicki;03 Transfer technologii i udoskonalanie sieci wspÛ≥pracy miÍdzy MåP, miÍdzy MåP a innymi przedsiÍbiorstwami, uczelniami, wszelkiego rodzaju instytucjami na poziomie szkolnictwa pomaturalnego, w≥adzami regionalnymi, oúrodkami badawczymi oraz biegunami naukowymi i technologicznymi (parkami naukowymi i technologicznymi, technopoliami itd.);Stowarzyszenia i organizacje spo≥eczne;00 Nie dotyczy;POIG.05.01.00-00-005/09-02;Nie;2011/04/29;2011/05/13
33-132;33;Projekt;Wsparcie efektywnego wykorzystania w≥asnoúci przemys≥owej w innowacyjnej gospodarce;POIG.05.02.00-00-004/10-00;Program Operacyjny Innowacyjna Gospodarka;POIG.05.00.00;POIG.05.02.00;;10,770,000.00;10,770,000.00;10,770,000.00;9,154,500.00;Urzπd Patentowy RP;5261048480;00-950;Warszawa;;;05 Us≥ugi w zakresie zaawansowanego wsparcia dla przedsiÍbiorstw i grup przedsiÍbiorstw;organ w≥adzy, administracji rzπdowej;00 Nie dotyczy;;;2011/04/14;2011/04/19
