33-181;33;Projekt;Zapewnienie wsparcia zarzπdzania realizacjπ 7 osi i dzia≥aÒ 8.3 i 8.4 w ramach 8 osi POIG w 2011 roku realizowane przez WWPE  ;POIG.09.01.00-00-012/10-00;Program Operacyjny Innowacyjna Gospodarka;POIG.09.00.00;POIG.09.01.00;;8,244,000.00;8,244,000.00;8,244,000.00;7,007,400.00;W≥adza Wdraøajπca Programy Europejskie;5262735917;02-517;Warszawa;Mazowieckie;Powiat m. st. Warszawa;85 Przygotowanie, realizacja, monitorowanie i kontrola;organ w≥adzy, administracji rzπdowej;00 Nie dotyczy;;;2011/05/10;2011/05/13
33-182;33;Projekt;Wsparcie zarzπdzania w DPO w 2011 r.;POIG.09.01.00-00-014/10-00;Program Operacyjny Innowacyjna Gospodarka;POIG.09.00.00;POIG.09.01.00;;967,500.00;967,500.00;967,500.00;822,375.00;Ministerstwo Gospodarki, Departament Wdraøania ProgramÛw Operacyjnych;5262897181;00-507;Warszawa;Mazowieckie;Powiat m. st. Warszawa;85 Przygotowanie, realizacja, monitorowanie i kontrola;organ w≥adzy, administracji rzπdowej;00 Nie dotyczy;;;2011/02/16;2011/02/16
33-183;33;Projekt;Wsparcie procesÛw zarzπdzania Instytucji Poúredniczπcej (MSWiA) poprzez finansowanie kosztÛw realizacji 7. i 8. osi priorytetowej PO IG w 2011 roku;POIG.09.01.00-00-017/10-00;Program Operacyjny Innowacyjna Gospodarka;POIG.09.00.00;POIG.09.01.00;;1,613,000.00;1,613,000.00;1,613,000.00;1,371,050.00;Ministerstwo Spraw WewnÍtrznych i Administracji;5210526030;02-591;Warszawa;Mazowieckie;Powiat m. st. Warszawa;85 Przygotowanie, realizacja, monitorowanie i kontrola;organ w≥adzy, administracji rzπdowej;00 Nie dotyczy;;;2011/01/21;2011/02/08
33-184;33;Projekt;Wsparcie zarzπdzania PARP w 2011 roku;POIG.09.01.00-00-018/10-00;Program Operacyjny Innowacyjna Gospodarka;POIG.09.00.00;POIG.09.01.00;;72,293,340.00;72,293,340.00;72,293,340.00;61,449,339.00;Polska Agencja Rozwoju PrzedsiÍbiorczoúci;5262501444;00-834;Warszawa;Mazowieckie;Powiat m. st. Warszawa;85 Przygotowanie, realizacja, monitorowanie i kontrola;paÒstwowa osoba prawna;00 Nie dotyczy;POIG.09.01.00-00-018/10-01;Nie;2011/01/25;2011/01/26
33-185;33;Projekt;Wsparcie zarzπdzania - POT -2011;POIG.09.01.00-00-019/10-00;Program Operacyjny Innowacyjna Gospodarka;POIG.09.00.00;POIG.09.01.00;;2,590,000.00;2,590,000.00;2,590,000.00;2,201,500.00;Polska Organizacja Turystyczna;5252150196;00-613;Warszawa;Mazowieckie;Powiat m. st. Warszawa;85 Przygotowanie, realizacja, monitorowanie i kontrola;paÒstwowa osoba prawna;00 Nie dotyczy;POIG.09.01.00-00-019/10-02;Nie;2011/02/17;2011/02/22
33-186;33;Projekt;Wsparcie zarzπdzania IW w 2011 r.;POIG.09.01.00-00-021/10-00;Program Operacyjny Innowacyjna Gospodarka;POIG.09.00.00;POIG.09.01.00;;5,524,100.00;5,524,100.00;5,524,100.00;4,695,485.00;Oúrodek Przetwarzania Informacji;5250009140;00-608;Warszawa;Mazowieckie;Powiat m. st. Warszawa;85 Przygotowanie, realizacja, monitorowanie i kontrola;jednostka naukowa;00 Nie dotyczy;POIG.09.01.00-00-021/10-02;Nie;2011/01/17;2011/01/19
33-187;33;Projekt;Wyposaøenie instytucji - POT-2011;POIG.09.02.00-00-012/10-00;Program Operacyjny Innowacyjna Gospodarka;POIG.09.00.00;POIG.09.02.00;;470,000.00;470,000.00;470,000.00;399,500.00;Polska Organizacja Turystyczna;5252150196;00-613;Warszawa;Mazowieckie;Powiat m. st. Warszawa;85 Przygotowanie, realizacja, monitorowanie i kontrola;paÒstwowa osoba prawna;00 Nie dotyczy;POIG.09.02.00-00-012/10-02;Nie;2011/01/04;2011/01/14
33-188;33;Projekt;Wyposaøenie stanowisk pracy personelu zarzπdzajπcego realizacjπ 7 osi i dzia≥ania 8.3 i 8.4 w ramach 8 osi POIG w 2011 roku realizowane przez WWPE;POIG.09.02.00-00-013/10-00;Program Operacyjny Innowacyjna Gospodarka;POIG.09.00.00;POIG.09.02.00;;1,389,000.00;1,389,000.00;1,389,000.00;1,180,650.00;W≥adza Wdraøajπca Programy Europejskie;5262735917;02-517;Warszawa;Mazowieckie;Powiat m. st. Warszawa;85 Przygotowanie, realizacja, monitorowanie i kontrola;organ w≥adzy, administracji rzπdowej;00 Nie dotyczy;;;2011/05/10;2011/05/13
33-189;33;Projekt;Wyposaøenie instytucji PARP i RIF w 2011 r.;POIG.09.02.00-00-018/10-00;Program Operacyjny Innowacyjna Gospodarka;POIG.09.00.00;POIG.09.02.00;;5,948,977.88;5,948,977.88;5,948,977.88;5,056,631.19;Polska Agencja Rozwoju PrzedsiÍbiorczoúci;5262501444;00-834;Warszawa;Mazowieckie;Powiat m. st. Warszawa;85 Przygotowanie, realizacja, monitorowanie i kontrola;paÒstwowa jednostka organizacyjna;00 Nie dotyczy;POIG.09.02.00-00-018/10-02;Nie;2011/03/24;2011/05/04
33-190;33;Projekt;Wyposaøenie w sprzÍt komputerowy, biurowy, materia≥y biurowe, eksploatacyjne, finansowanie kosztÛw uøytkowania telefonÛw s≥uøbowych pracownikÛw na potrzeby IP II dla dzia≥ania 4.5 oraz poddzia≥aÒ 6.2.2 i 6.5.2 PO IG w Ministerstwie Gospodarki.;POIG.09.02.00-00-019/10-00;Program Operacyjny Innowacyjna Gospodarka;POIG.09.00.00;POIG.09.02.00;;481,999.23;481,999.23;481,999.23;409,699.35;Ministerstwo Gospodarki, Departament Wdraøania ProgramÛw Operacyjnych;5262897181;00-507;Warszawa;Mazowieckie;Powiat m. st. Warszawa;85 Przygotowanie, realizacja, monitorowanie i kontrola;organ w≥adzy, administracji rzπdowej;00 Nie dotyczy;;;2011/01/18;2011/01/25
33-191;33;Projekt;Wyposaøenie Instytucji Poúredniczπcej (MSWiA) poprzez finansowanie kosztÛw wyposaøenia stanowisk pracy pracownikÛw zaangaøowanych w realizacjÍ 7 i 8 osi priorytetowej PO IG w 2011 roku;POIG.09.02.00-00-020/10-00;Program Operacyjny Innowacyjna Gospodarka;POIG.09.00.00;POIG.09.02.00;;1,002,788.00;1,002,788.00;1,002,788.00;852,369.80;Ministerstwo Spraw WewnÍtrznych i Administracji;5210526030;02-591;Warszawa;Mazowieckie;Powiat m. st. Warszawa;85 Przygotowanie, realizacja, monitorowanie i kontrola;organ w≥adzy, administracji rzπdowej;00 Nie dotyczy;POIG.09.02.00-00-020/10-01;Nie;2011/04/27;2011/05/16
33-192;33;Projekt;Wyposaøenie Instytucji Wdraøajπcej w 2011 r.;POIG.09.02.00-00-022/10-00;Program Operacyjny Innowacyjna Gospodarka;POIG.09.00.00;POIG.09.02.00;;595,160.00;595,160.00;595,160.00;505,886.00;Oúrodek Przetwarzania Informacji;5250009140;00-608;Warszawa;Mazowieckie;Powiat m. st. Warszawa;85 Przygotowanie, realizacja, monitorowanie i kontrola;jednostka naukowa;00 Nie dotyczy;POIG.09.02.00-00-022/10-01;Nie;2011/01/17;2011/01/19
33-193;33;Projekt;Informacja i promocja w ramach 7 osi priorytetowej i dzia≥ania 8.3 i 8.4 w ramach 8 osi POIG w 2011 roku realizowana przez WWPE;POIG.09.03.00-00-014/10-00;Program Operacyjny Innowacyjna Gospodarka;POIG.09.00.00;POIG.09.03.00;;660,000.00;660,000.00;660,000.00;561,000.00;W≥adza Wdraøajπca Programy Europejskie;5262735917;00-926;Warszawa;Mazowieckie;Powiat m. st. Warszawa;86 Ocena, badania/ekspertyzy, informacja i komunikacja;organ w≥adzy, administracji rzπdowej;00 Nie dotyczy;POIG.09.03.00-00-014/10-01;Nie;2011/03/03;2011/05/04
33-194;33;Projekt;Dzia≥ania informacyjno-promocyjne realizowane w 2011 roku przez InstytucjÍ Wdraøajπcπ dzia≥anie 4.5 i poddzia≥ania 6.2.2, 6.5.2 PO IG;POIG.09.03.00-00-015/10-00;Program Operacyjny Innowacyjna Gospodarka;POIG.09.00.00;POIG.09.03.00;;678,800.00;678,800.00;678,800.00;576,980.00;Ministerstwo Gospodarki, Departament Wdraøania ProgramÛw Operacyjnych;5262897181;00-507;Warszawa;Mazowieckie;Powiat m. st. Warszawa;86 Ocena, badania/ekspertyzy, informacja i komunikacja;organ w≥adzy, administracji rzπdowej;00 Nie dotyczy;POIG.09.03.00-00-015/10-01;Nie;2011/01/18;2011/01/25
33-195;33;Projekt;Informacja i promocja - POT - 2011;POIG.09.03.00-00-017/10-00;Program Operacyjny Innowacyjna Gospodarka;POIG.09.00.00;POIG.09.03.00;;140,000.00;140,000.00;140,000.00;119,000.00;Polska Organizacja Turystyczna;5252150196;00-613;Warszawa;Mazowieckie;Powiat m. st. Warszawa;86 Ocena, badania/ekspertyzy, informacja i komunikacja;paÒstwowa osoba prawna;00 Nie dotyczy;POIG.09.03.00-00-017/10-02;Nie;2011/01/04;2011/01/14
33-196;33;Projekt;Dzia≥ania informacyjne i promocyjne Instytucji Poúredniczπcej (MSWiA) realizowane w ramach 7. i 8. osi priorytetowej PO IG w 2011 roku;POIG.09.03.00-00-020/10-00;Program Operacyjny Innowacyjna Gospodarka;POIG.09.00.00;POIG.09.03.00;;1,225,000.00;1,225,000.00;1,225,000.00;1,041,250.00;Ministerstwo Spraw WewnÍtrznych i Administracji;5210526030;02-591;Warszawa;Mazowieckie;Powiat m. st. Warszawa;86 Ocena, badania/ekspertyzy, informacja i komunikacja;organ w≥adzy, administracji rzπdowej;00 Nie dotyczy;;;2011/01/21;2011/02/08
33-197;33;Projekt;Dzia≥ania informacyjne i promocyjne IW w 2011 r.;POIG.09.03.00-00-023/10-00;Program Operacyjny Innowacyjna Gospodarka;POIG.09.00.00;POIG.09.03.00;;1,020,750.00;1,020,750.00;1,020,750.00;867,637.50;Oúrodek Przetwarzania Informacji;5250009140;00-608;Warszawa;Mazowieckie;Powiat m. st. Warszawa;86 Ocena, badania/ekspertyzy, informacja i komunikacja;jednostka naukowa;00 Nie dotyczy;POIG.09.03.00-00-023/10-02;Nie;2011/01/17;2011/01/19
33-198;33;Projekt;Dzia≥ania informacyjno-promocyjne realizowane w ramach Programu Operacyjnego Innowacyjna Gospodarka, wdraøanego przez Polskπ AgencjÍ Rozwoju PrzedsiÍbiorczoúci w 2011 roku.;POIG.09.03.00-00-024/10-00;Program Operacyjny Innowacyjna Gospodarka;POIG.09.00.00;POIG.09.03.00;;1,091,000.00;1,091,000.00;1,091,000.00;927,350.00;Polska Agencja Rozwoju PrzedsiÍbiorczoúci;5262501444;00-834;Warszawa;Mazowieckie;Powiat m. st. Warszawa;86 Ocena, badania/ekspertyzy, informacja i komunikacja;paÒstwowa osoba prawna;00 Nie dotyczy;POIG.09.03.00-00-024/10-01;Nie;2011/04/20;2011/04/21
33-199;33;Projekt;Ewaluacja wdraøania I II Priorytetu PO IG w 2011 r.;POIG.09.04.00-00-006/10-00;Program Operacyjny Innowacyjna Gospodarka;POIG.09.00.00;POIG.09.04.00;;182,000.00;182,000.00;182,000.00;154,700.00;Minister Nauki i Szkolnictwa Wyøszego;7010014467;00-529;Warszawa;Mazowieckie;Powiat m. st. Warszawa;86 Ocena, badania/ekspertyzy, informacja i komunikacja;organ w≥adzy, administracji rzπdowej;00 Nie dotyczy;;;2011/02/15;2011/02/22
33-200;33;Projekt;Ewaluacja w ramach 7 i 8 osi priorytetowej POIG w 2011 roku realizowana przez WWPE;POIG.09.04.00-00-015/10-00;Program Operacyjny Innowacyjna Gospodarka;POIG.09.00.00;POIG.09.04.00;;80,000.00;80,000.00;80,000.00;68,000.00;W≥adza Wdraøajπca Programy Europejskie;5262735917;00-926;Warszawa;Mazowieckie;Powiat m. st. Warszawa;86 Ocena, badania/ekspertyzy, informacja i komunikacja;organ w≥adzy, administracji rzπdowej;00 Nie dotyczy;;;2011/03/03;2011/05/04
33-201;33;Projekt;Ewaluacja PO IG 2011;POIG.09.04.00-00-025/10-00;Program Operacyjny Innowacyjna Gospodarka;POIG.09.00.00;POIG.09.04.00;;1,181,000.00;1,181,000.00;1,181,000.00;1,003,850.00;Polska Agencja Rozwoju PrzedsiÍbiorczoúci;5262501444;00-834;Warszawa;Mazowieckie;Powiat m. st. Warszawa;86 Ocena, badania/ekspertyzy, informacja i komunikacja;paÒstwowa osoba prawna;00 Nie dotyczy;POIG.09.04.00-00-025/10-01;Nie;2011/04/20;2011/04/21
33-202;33;Projekt;Kompleksowe zagospodarowanie úciekÛw w zlewni rzeki Obry - Gmina åmigiel;POIS.01.01.00-00-010/08-02;Program Operacyjny Infrastruktura i årodowisko;POIS.01.00.00;POIS.01.01.00;;71,760,212.23;51,619,290.77;43,876,397.16;43,876,397.16;Gmina åmigiel;6981722462;64-030;åmigiel;Wielkopolskie;Powiat koúciaÒski;46 Oczyszczanie úciekÛw;wspÛlnota samorzπdowa - gmina;00 Nie dotyczy;POIS.01.01.00-00-010/08-08;Nie;2011/02/17;2011/02/17
33-203;33;Projekt;Racjonalna gospodarka wodπ w aspekcie spo≥.-gosp. rozwoju Gmin Mazowsza Zachodniego - Gmina Radziejowice;POIS.01.01.00-00-102/10-00;Program Operacyjny Infrastruktura i årodowisko;POIS.01.00.00;POIS.01.01.00;;25,799,372.33;9,934,886.41;8,444,653.45;8,444,653.45;Gmina Radziejowice;8381426414;96-325;Radziejowice;Mazowieckie;Powiat øyrardowski;46 Oczyszczanie úciekÛw;wspÛlnota samorzπdowa - gmina;00 Nie dotyczy;;;2011/02/10;2011/02/11
33-204;33;Projekt;Program Gospodarki Odpadami Komunalnymi w Krakowie;POIS.02.01.00-00-005/10-00;Program Operacyjny Infrastruktura i årodowisko;POIS.02.00.00;POIS.02.01.00;;792,182,089.83;437,327,121.14;371,728,052.96;371,728,052.96;Krakowski Holding Komunalny S.A.;6791862817;30-347;KrakÛw;Ma≥opolskie;Powiat m. KrakÛw;44 Gospodarka odpadami komunalnymi i przemys≥owymi;spÛ≥ka akcyjna - duøe przedsiÍbiorstwo;00 Nie dotyczy;;;2011/04/20;2011/04/26
33-205;33;Projekt;Budowa Zak≥adu Termicznego Przekszta≥cania OdpadÛw Komunalnych dla Bydgosko-ToruÒskiego Obszaru Metropolitarnego;POIS.02.01.00-00-007/09-00;Program Operacyjny Infrastruktura i årodowisko;POIS.02.00.00;POIS.02.01.00;;619,646,191.24;399,638,899.09;339,693,064.22;339,693,064.22;MiÍdzygminny Kompleks Unieszkodliwiania OdpadÛw ProNatura Sp. z o.o.;9532559741;85-893;Bydgoszcz;Kujawsko-pomorskie;Powiat m. Bydgoszcz;44 Gospodarka odpadami komunalnymi i przemys≥owymi;spÛ≥ka z ograniczonπ odpowiedzialnoúciπ - duøe przedsiÍbiorstwo;00 Nie dotyczy;;;2011/03/03;2011/03/04
33-206;33;Projekt;Uporzπdkowanie gospodarki odpadami na terenie subregionu koniÒskiego;POIS.02.01.00-00-009/10-00;Program Operacyjny Infrastruktura i årodowisko;POIS.02.00.00;POIS.02.01.00;;313,767,355.04;181,780,989.59;154,513,841.15;154,513,841.15;"Zwiπzek MiÍdzygminny ""KoniÒski Region Komunalny""";6652260144;62-510;Konin;Wielkopolskie;Powiat koniÒski / Powiat m. Konin;44 Gospodarka odpadami komunalnymi i przemys≥owymi;wspÛlnota samorzπdowa;00 Nie dotyczy;;;2011/05/27;2011/05/30
33-207;33;Projekt;Wdroøenie Systemu Zarzπdzania årodowiskowego wed≥ug normy ISO 14001:2005 w Elektromont 1 Sp. z o.o.;POIS.04.01.00-00-004/10-00;Program Operacyjny Infrastruktura i årodowisko;POIS.04.00.00;POIS.04.01.00;;81,618.00;62,940.00;31,470.00;31,470.00;Elektromont 1 Sp. z o.o.;6652648291;62-510;Konin;Wielkopolskie;Powiat koniÒski / Powiat m. Konin;54 Inne dzia≥ania na rzecz ochrony úrodowiska i zapobiegania zagroøeniom;spÛ≥ka z ograniczonπ odpowiedzialnoúciπ - úrednie przedsiÍbiorstwo;00 Nie dotyczy;POIS.04.01.00-00-004/10-01;Nie;2011/03/01;2011/03/23
33-208;33;Projekt;Wdroøenie systemu zarzπdzania ochronπ úrodowiska zgodnπ z wymaganiami miÍdzynarodowπ normπ ISO 14001.2004/PN-EN ISO 14001.2005 w przedsiÍbiorstwie Laboratoria Medyczne OptiMed Sp.j. Kuriata, WroÒski;POIS.04.01.00-00-006/10-00;Program Operacyjny Infrastruktura i årodowisko;POIS.04.00.00;POIS.04.01.00;;67,769.78;55,549.00;27,750.00;27,750.00;Laboratoria Medyczne Optimed Kuriata, WroÒski SpÛ≥ka Jawna;7422101075;11-400;KÍtrzyn;WarmiÒsko-mazurskie;Powiat kÍtrzyÒski;54 Inne dzia≥ania na rzecz ochrony úrodowiska i zapobiegania zagroøeniom;spÛ≥ka jawna - úrednie przedsiÍbiorstwo;00 Nie dotyczy;;;2011/02/28;2011/03/07
33-209;33;Projekt;Wdroøenie systemu zarzπdzania úrodowiskowego wed≥ug wymagaÒ ISO 14001:2004 w Biazet S.A.;POIS.04.01.00-00-007/10-00;Program Operacyjny Infrastruktura i årodowisko;POIS.04.00.00;POIS.04.01.00;;63,806.00;46,360.00;23,180.00;23,180.00;Biazet S.A.;5420201469;15-113;Bia≥ystok;Podlaskie;Powiat m. Bia≥ystok;54 Inne dzia≥ania na rzecz ochrony úrodowiska i zapobiegania zagroøeniom;spÛ≥ka akcyjna - duøe przedsiÍbiorstwo;00 Nie dotyczy;;;2011/03/08;2011/03/11
33-210;33;Projekt;Modernizacja linii technologicznej do produkcji mebli;POIS.04.02.00-00-031/09-00;Program Operacyjny Infrastruktura i årodowisko;POIS.04.00.00;POIS.04.02.00;;5,884,616.32;4,823,456.00;1,447,036.80;1,447,036.80;Steinpol Meble Sp. z o.o.;7781381577;69-110;Rzepin;Lubuskie;Powiat s≥ubicki;44 Gospodarka odpadami komunalnymi i przemys≥owymi;spÛ≥ka z ograniczonπ odpowiedzialnoúciπ - duøe przedsiÍbiorstwo;00 Nie dotyczy;POIS.04.02.00-00-031/09-01;Nie;2011/01/28;2011/01/31
33-211;33;Projekt;Budowa silosu klinkieru zgodnie z programem dostosowawczym Pozwolenia Zintegr. w Cementowni Rudniki;POIS.04.03.00-00-007/09-01;Program Operacyjny Infrastruktura i årodowisko;POIS.04.00.00;POIS.04.03.00;;47,686,750.00;39,081,500.00;11,724,450.00;11,724,450.00;Cemex Polska Sp. z o.o.;9511496432;02-486;Warszawa;Mazowieckie;Powiat m. st. Warszawa;48 Zintegrowany system zapobiegania i kontroli zanieczyszczeÒ;spÛ≥ka z ograniczonπ odpowiedzialnoúciπ - duøe przedsiÍbiorstwo;00 Nie dotyczy;POIS.04.03.00-00-007/09-04;Nie;2011/01/13;2011/01/14
33-212;33;Projekt;"""Budowa linii produkcji paliwa alternatywnego z odpadÛw w PrzedsiÍbiorstwie EMPOL w Gorlicach""";POIS.04.06.00-00-006/09-03;Program Operacyjny Infrastruktura i årodowisko;POIS.04.00.00;POIS.04.06.00;;10,137,062.97;8,113,014.61;2,433,904.38;2,433,904.38;PrzedsiÍbiorstwo Us≥ug Komunalnych EMPOL Sp. z o.o.;7352497196;34-451;Tylmanowa;Ma≥opolskie;Powiat nowotarski;44 Gospodarka odpadami komunalnymi i przemys≥owymi;spÛ≥ka z ograniczonπ odpowiedzialnoúciπ - úrednie przedsiÍbiorstwo;00 Nie dotyczy;POIS.04.06.00-00-006/09-04;Nie;2011/03/10;2011/03/16
33-213;33;Projekt;"Oúrodek Rehabilitacji Krajowych PtakÛw Chronionych ""Ptasi Azyl""";POIS.05.01.00-00-154/09-00;Program Operacyjny Infrastruktura i årodowisko;POIS.05.00.00;POIS.05.01.00;;3,776,537.36;3,776,537.36;3,210,056.75;3,210,056.75;Miasto Sto≥eczne Warszawa;5252248481;00-950;Warszawa;;;51 Promowanie biorÛønorodnoúci i ochrony przyrody (w tym NATURA 2000);wspÛlnota samorzπdowa - gmina;00 Nie dotyczy;;;2011/04/22;2011/04/22
33-214;33;Projekt;Kompleksowa ochrona torfowisk wysokich na terenie wojewÛdztwa warmiÒsko- mazurskiego;POIS.05.01.00-00-215/09-00;Program Operacyjny Infrastruktura i årodowisko;POIS.05.00.00;POIS.05.01.00;;4,791,468.00;4,791,468.00;4,072,747.80;4,072,747.80;Polskie Towarzystwo Ochrony PtakÛw;5431181345;15-471;Bia≥ystok;Podlaskie;Powiat m. Bia≥ystok;51 Promowanie biorÛønorodnoúci i ochrony przyrody (w tym NATURA 2000);stowarzyszenie;00 Nie dotyczy;;;2011/04/22;2011/04/22
33-215;33;Projekt;Krajowy Program Ochrony G≥uszca;POIS.05.03.00-00-046/08-02;Program Operacyjny Infrastruktura i årodowisko;POIS.05.00.00;POIS.05.03.00;;1,066,966.38;1,066,966.38;906,921.42;906,921.42;Polskie Towarzystwo Ochrony PtakÛw;5431181345;17-230;Bia≥owieøa;Podlaskie;Powiat hajnowski;51 Promowanie biorÛønorodnoúci i ochrony przyrody (w tym NATURA 2000);stowarzyszenie;00 Nie dotyczy;POIS.05.03.00-00-046/08-05;Nie;2011/04/18;2011/04/29
33-216;33;Projekt;Opracowanie krajowych strategii gospodarowania wybranymi gatunkami zagroøonymi lub konfliktowymi;POIS.05.03.00-00-050/08-02;Program Operacyjny Infrastruktura i årodowisko;POIS.05.00.00;POIS.05.03.00;;1,245,091.90;1,245,091.90;1,058,328.12;1,058,328.12;Szko≥a G≥Ûwna Gospodarstwa Wiejskiego w Warszawie;5250007425;02-787;Warszawa;Mazowieckie;Powiat m. st. Warszawa;51 Promowanie biorÛønorodnoúci i ochrony przyrody (w tym NATURA 2000);uczelnia wyøsza;00 Nie dotyczy;POIS.05.03.00-00-050/08-06;Nie;2011/01/13;2011/02/17
33-217;33;Projekt;Sprawne wykrywanie i sankcjonowanie przestÍpstw przeciwko úrodowisku - cykl szkoleÒ dla Straøy Leúnej;POIS.05.04.00-00-007/08-02;Program Operacyjny Infrastruktura i årodowisko;POIS.05.00.00;POIS.05.04.00;;2,059,875.20;2,047,306.70;1,022,506.24;1,022,506.24;Oúrodek Rozwojowo-Wdroøeniowy LasÛw PaÒstwowych w Bedoniu;7280008666;95-020;Andrespol;£Ûdzkie;Powiat ≥Ûdzki wschodni;51 Promowanie biorÛønorodnoúci i ochrony przyrody (w tym NATURA 2000);paÒstwowa jednostka organizacyjna;00 Nie dotyczy;;;2011/01/24;2011/02/03
33-218;33;Projekt;Edukacja pracownikÛw LasÛw PaÒstwowych dotyczπca metod lokalizacji, monitoringu i ochrony puchacza. Bubobory w LP ;POIS.05.04.00-00-008/08-02;Program Operacyjny Infrastruktura i årodowisko;POIS.05.00.00;POIS.05.04.00;;736,833.80;706,168.00;600,242.80;600,242.80;Leúny Zak≥ad Doúwiadczalny Centrum Edukacji Przyrodniczo-Leúnej SGGW;5250007425;95-063;RogÛw;£Ûdzkie;Powiat brzeziÒski;51 Promowanie biorÛønorodnoúci i ochrony przyrody (w tym NATURA 2000);jednostka naukowa;00 Nie dotyczy;POIS.05.04.00-00-008/08-06;Nie;2011/03/02;2011/03/16
33-219;33;Projekt;SieÊ Natura 2000 - drogπ do rozwoju;POIS.05.04.00-00-187/09-03;Program Operacyjny Infrastruktura i årodowisko;POIS.05.00.00;POIS.05.04.00;;3,673,960.00;3,673,960.00;3,673,960.00;3,122,866.00;Generalna Dyrekcja Ochrony årodowiska;7010151052;00-922;Warszawa;Mazowieckie;Powiat m. st. Warszawa;51 Promowanie biorÛønorodnoúci i ochrony przyrody (w tym NATURA 2000);organ w≥adzy, administracji rzπdowej;00 Nie dotyczy;;;2011/05/06;2011/05/12
33-220;33;Projekt;Z≥ap rÛwnowagÍ, odkryj NaturÍ;POIS.05.04.00-00-267/09-02;Program Operacyjny Infrastruktura i årodowisko;POIS.05.00.00;POIS.05.04.00;;6,272,941.18;6,272,941.18;6,272,941.18;5,332,000.00;Generalna Dyrekcja Ochrony årodowiska;7010151052;00-922;Warszawa;Mazowieckie;Powiat m. st. Warszawa;51 Promowanie biorÛønorodnoúci i ochrony przyrody (w tym NATURA 2000);organ w≥adzy, administracji rzπdowej;00 Nie dotyczy;;;2011/05/20;2011/05/27
33-221;33;Projekt;Budowa po≥πczenia kolejowego MPL Katowice w Pyrzowicach z miastami aglomeracji gÛrnoúlπskiej, odcinek Katowice-Pyrzowice-PRACE PRZYGOTOWAWCZE;POIS.07.01.00-00-008/09-01;Program Operacyjny Infrastruktura i årodowisko;POIS.07.00.00;POIS.07.01.00;;63,462,204.00;52,018,200.00;52,018,200.00;44,215,470.00;PKP Polskie Linie Kolejowe S.A.;1132316427;03-734;Warszawa;Mazowieckie;Powiat m. st. Warszawa;16 Kolej;spÛ≥ka akcyjna - duøe przedsiÍbiorstwo;00 Nie dotyczy;POIS.07.01.00-00-008/09-03;Nie;2011/03/15;2011/03/17
33-222;33;Projekt;Projekt poprawy dostÍpu kolejowego do Portu GdaÒsk (most + dwutorowa linia kolejowa) - PRACE PRZYGOTOWAWCZE;POIS.07.02.00-00-011/09-01;Program Operacyjny Infrastruktura i årodowisko;POIS.07.00.00;POIS.07.02.00;;20,347,125.00;16,524,375.00;16,524,375.00;14,045,718.75;PKP Polskie Linie Kolejowe S.A.;1132316427;03-734;Warszawa;Mazowieckie;Powiat m. st. Warszawa;30 Porty;spÛ≥ka akcyjna - duøe przedsiÍbiorstwo;00 Nie dotyczy;;;2011/03/15;2011/03/17
33-223;33;Projekt;Klub Pancernika Klika w Fotelikach;POIS.08.01.00-00-006/10-01;Program Operacyjny Infrastruktura i årodowisko;POIS.08.00.00;POIS.08.01.00;;5,000,000.00;5,000,000.00;5,000,000.00;4,250,000.00;Instytut Transportu Samochodowego;5250008382;03-301;Warszawa;Mazowieckie;Powiat m. st. Warszawa;22 Drogi krajowe;jednostka naukowa;00 Nie dotyczy;;;2011/04/19;2011/05/06
33-224;33;Projekt;Kampanie spo≥eczne promujπce bezpieczne zachowania wúrÛd uczestnikÛw ruchu drogowego;POIS.08.01.00-00-008/10-01;Program Operacyjny Infrastruktura i årodowisko;POIS.08.00.00;POIS.08.01.00;;11,040,000.00;11,040,000.00;11,040,000.00;9,384,000.00;Ministerswto Infrastruktury;7010095164;00-926;Warszawa;Mazowieckie;Powiat m. st. Warszawa;22 Drogi krajowe;organ w≥adzy, administracji rzπdowej;00 Nie dotyczy;POIS.08.01.00-00-008/10-02;Nie;2011/04/14;2011/04/15
33-225;33;Projekt;Zakup i montaø nowego turbogeneratora w Synthos Dwory Sp. z o.o.;POIS.09.01.00-00-123/09-01;Program Operacyjny Infrastruktura i årodowisko;POIS.09.00.00;POIS.09.01.00;;45,898,693.00;36,764,000.00;18,382,000.00;18,382,000.00;Synthos Dwory Sp. z o.o.;9591762828;32-600;OúwiÍcim;Ma≥opolskie;Powiat oúwiÍcimski;43 EfektywnoúÊ energetyczna, produkcja skojarzona (kogeneracja), zarzπdzanie energiπ;spÛ≥ka z ograniczonπ odpowiedzialnoúciπ - duøe przedsiÍbiorstwo;00 Nie dotyczy;POIS.09.01.00-00-123/09-04;Nie;2011/03/28;2011/04/05
33-226;33;Projekt;Budowa elektrociep≥owni wysokosprawnej kogeneracji na biomasÍ w Ar≥amowie;POIS.09.01.00-00-138/09-00;Program Operacyjny Infrastruktura i årodowisko;POIS.09.00.00;POIS.09.01.00;;36,884,760.00;26,850,000.00;16,110,000.00;16,110,000.00;Oúrodek Wypoczynkowy ÑAR£AM”Wî S.A.;6891093258;38-712;Wojtkowa;Podkarpackie;Powiat bieszczadzki;43 EfektywnoúÊ energetyczna, produkcja skojarzona (kogeneracja), zarzπdzanie energiπ;spÛ≥ka akcyjna - duøe przedsiÍbiorstwo;00 Nie dotyczy;;;2011/03/03;2011/03/09
33-227;33;Projekt;"Budowa stacji 400/220/110 kV O≥tarzew - czÍúÊ Projektu ""Po≥πczenie elektroenergetyczne Polska-Litwa";POIS.10.01.00-00-005/10-00;Program Operacyjny Infrastruktura i årodowisko;POIS.10.00.00;POIS.10.01.00;;276,609,213.59;210,832,922.81;116,190,023.76;116,190,023.76;Polskie Sieci Elektroenergetyczne - Operator S.A.;5262748966;05-520;Konstancin-Jeziorna;Mazowieckie;Powiat piaseczyÒski;34 Energia elektryczna (sieci TEN-E);spÛ≥ka akcyjna - duøe przedsiÍbiorstwo;00 Nie dotyczy;;;2011/03/16;2011/03/16
33-228;33;Projekt;RPD IZ na rok 2011;POIS.14.01.00-00-101/11-00;Program Operacyjny Infrastruktura i årodowisko;POIS.14.00.00;POIS.14.01.00;;4,000,000.00;4,000,000.00;4,000,000.00;3,400,000.00;Ministerstwo Rozwoju Regionalnego, Departament Koordynacji ProgramÛw Infrastrukturalnych;5262895199;00-926;Warszawa;Mazowieckie;Powiat m. st. Warszawa;85 Przygotowanie, realizacja, monitorowanie i kontrola;paÒstwowa jednostka organizacyjna;00 Nie dotyczy;;;2011/01/25;2011/01/28
33-229;33;Projekt;RPD sektora kultura na rok 2010 (MKiDN);POIS.14.01.00-00-501/10-01;Program Operacyjny Infrastruktura i årodowisko;POIS.14.00.00;POIS.14.01.00;;1,314,512.08;1,314,512.08;1,314,512.08;1,117,335.26;Ministerstwo Kultury i Dziedzictwa Narodowego;5260308476;00-071;Warszawa;Mazowieckie;Powiat m. st. Warszawa;85 Przygotowanie, realizacja, monitorowanie i kontrola;organ w≥adzy, administracji rzπdowej;00 Nie dotyczy;POIS.14.01.00-00-501/10-01;Nie;2011/02/04;2011/02/22
33-230;33;Projekt;RPD sektora zdrowie na rok 2011 (MZ);POIS.14.01.00-00-601/11-00;Program Operacyjny Infrastruktura i årodowisko;POIS.14.00.00;POIS.14.01.00;;543,000.00;543,000.00;543,000.00;461,550.00;Ministerstwo Zdrowia, Departament Funduszy Europejskich;5251918554;00-952;Warszawa;;;85 Przygotowanie, realizacja, monitorowanie i kontrola;organ w≥adzy, administracji rzπdowej;00 Nie dotyczy;;;2011/04/01;2011/04/06
33-231;33;Projekt;RPD sektora zdrowie na rok 2011 (CSIOZ);POIS.14.01.00-00-602/11-00;Program Operacyjny Infrastruktura i årodowisko;POIS.14.00.00;POIS.14.01.00;;5,919,000.00;5,919,000.00;5,919,000.00;5,031,150.00;Centrum SystemÛw Informacyjnych Ochrony Zdrowia;5251575309;00-184;Warszawa;Mazowieckie;Powiat m. st. Warszawa;85 Przygotowanie, realizacja, monitorowanie i kontrola;paÒstwowa jednostka organizacyjna;00 Nie dotyczy;;;2011/04/13;2011/04/18
